{
  "schema_version": "1.0",
  "site": "bray",
  "input_url": "https://www.bray.com/",
  "run_at": "2026-10-11T02:31:00Z",
  "agent": {
    "name": "gold-blind-imgdoc",
    "version": "1"
  },
  "gold_meta": {
    "labeller": "devin (blind)",
    "labelled_at": "2026-10-11",
    "notes": "Blind image-only and doc_type-only re-label of 6 families under SPEC 4/5. specs/variants intentionally empty. family_index lists only these 6 families (needed by validate --gold); it is NOT the complete site index."
  },
  "family_index": [
    {
      "url": "https://www.bray.com/valves-actuators-controls/control-accessories/switch-boxes/series-5a-switch-box",
      "name": "Series 5A",
      "aliases": []
    },
    {
      "url": "https://www.bray.com/valves-actuators-controls/actuators/electric-actuator/series-70-hazardous-location",
      "name": "Series 70-HAZ",
      "aliases": []
    },
    {
      "url": "https://www.bray.com/valves-actuators-controls/actuators/manual-operators/srh-series-manual-actuator",
      "name": "SRH Series",
      "aliases": []
    },
    {
      "url": "https://www.bray.com/valves-actuators-controls/control-accessories/switch-boxes/series-5b-resin-switch-box",
      "name": "Series 5B Resin",
      "aliases": []
    },
    {
      "url": "https://www.bray.com/valves-actuators-controls/control-accessories/switch-boxes/series-5b-switch-box",
      "name": "Series 5B",
      "aliases": []
    },
    {
      "url": "https://www.bray.com/valves-actuators-controls/ball-valves/trunnion-mounted-valves/trunnion-mounted-ball-valve",
      "name": "Series 1B",
      "aliases": []
    }
  ],
  "families": [
    {
      "family_id": "series-5a",
      "name": "Series 5A",
      "canonical_url": "https://www.bray.com/valves-actuators-controls/control-accessories/switch-boxes/series-5a-switch-box",
      "specs": {},
      "variants": [],
      "documents": [
        {
          "url": "https://www.bray.com/docs/default-source/manuals-guides/technical-manuals/tm-1090_5a_aluminum.pdf",
          "doc_type": "spec_sheet",
          "priority": "primary",
          "lang": "en",
          "title": "Series 5A Aluminum Switch Box",
          "revision_date": "2022-10-14",
          "sha256": "647c8649338d18fdbbd4e8fcf8e100b2f11c8ab189544f64bd5255d635048526",
          "bytes": 395819,
          "http_status": 200,
          "mime_verified": true,
          "found_on": "https://www.bray.com/valves-actuators-controls/control-accessories/switch-boxes/series-5a-switch-box",
          "variant_skus": []
        },
        {
          "url": "https://www.bray.com/docs/default-source/brochures/product-brochures/switchbox-series-5a-b-c/b-1068-s5a-5b-5c-vsm-rev_compressed.pdf",
          "doc_type": "brochure",
          "priority": "secondary",
          "lang": "en",
          "title": "Series 5A, 5B and 5C Switchbox",
          "revision_date": "2022-04-11",
          "sha256": "abd019ee39349151b544b4c489849039e8d245347190baf24001ea1106064ce6",
          "bytes": 6414418,
          "http_status": 200,
          "mime_verified": true,
          "found_on": "https://www.bray.com/valves-actuators-controls/control-accessories/switch-boxes/series-5a-switch-box",
          "variant_skus": []
        },
        {
          "url": "https://www.bray.com/docs/default-source/brochures/product-brochures/en_vac_broc.pdf",
          "doc_type": "brochure",
          "priority": "secondary",
          "lang": "en",
          "title": "Valve Automation Centre (VAC)",
          "revision_date": "2024-08-13",
          "sha256": "580ecba3789ab1b0c5984b2d6a2dbd515e57b56f346ca7714513ac91ffe79df8",
          "bytes": 2301552,
          "http_status": 200,
          "mime_verified": true,
          "found_on": "https://www.bray.com/valves-actuators-controls/control-accessories/switch-boxes/series-5a-switch-box",
          "variant_skus": []
        },
        {
          "url": "https://www.bray.com/docs/default-source/manuals-guides/iom-manuals/valve-status-monitors-series-5ab-om-en-us.pdf",
          "doc_type": "iom_manual",
          "priority": "secondary",
          "lang": "en",
          "title": "Series 5A/5B Switchbox",
          "revision_date": "2022",
          "sha256": "ef385b58783a37b135e6f84269578df096b25b3d440ec856f5dbd98b0e02d190",
          "bytes": 2747350,
          "http_status": 200,
          "mime_verified": true,
          "found_on": "https://www.bray.com/valves-actuators-controls/control-accessories/switch-boxes/series-5a-switch-box",
          "variant_skus": []
        },
        {
          "url": "https://www.bray.com/docs/default-source/manuals-guides/iom-manuals/en_br_iom_ct_s5a_5b-is_halfsize.pdf",
          "doc_type": "iom_manual",
          "priority": "secondary",
          "lang": "en",
          "title": "Series 5A/5B Intrinsically Safe Switchbox",
          "revision_date": "2022-12-22",
          "sha256": "26023dda6404f9b4982243799115f00179d85265d7e860b45a54484da9ac84f5",
          "bytes": 3063458,
          "http_status": 200,
          "mime_verified": true,
          "found_on": "https://www.bray.com/valves-actuators-controls/control-accessories/switch-boxes/series-5a-switch-box",
          "variant_skus": []
        },
        {
          "url": "https://www.bray.com/docs/default-source/manuals-guides/selection-guides/hazardous-location-products.pdf",
          "doc_type": "other_doc",
          "priority": "secondary",
          "lang": "en",
          "title": "Hazardous Location Products",
          "revision_date": "2020-03",
          "sha256": "a29e2520aa8a9142673eaa6c01e6ea367ce7fb0144983c8d0d2f54fce1d0fd6c",
          "bytes": 1852871,
          "http_status": 200,
          "mime_verified": true,
          "found_on": "https://www.bray.com/valves-actuators-controls/control-accessories/switch-boxes/series-5a-switch-box",
          "variant_skus": []
        },
        {
          "url": "https://www.bray.com/docs/default-source/manuals-guides/selection-guides/intriniscally-safe-product-selection.pdf",
          "doc_type": "catalog",
          "priority": "secondary",
          "lang": "en",
          "title": "Intriniscally Safe Reference Guide",
          "revision_date": "2020-06",
          "sha256": "7e3caea47519ab134b4ae75e837fb22bb91662a0ab9720423cf42e1f229d4563",
          "bytes": 894657,
          "http_status": 200,
          "mime_verified": true,
          "found_on": "https://www.bray.com/valves-actuators-controls/control-accessories/switch-boxes/series-5a-switch-box",
          "variant_skus": []
        },
        {
          "url": "https://www.bray.com/docs/default-source/manuals-guides/safety-manuals/en_sm_1007_5-abc-vsm_safety-manual.pdf",
          "doc_type": "iom_manual",
          "priority": "secondary",
          "lang": "en",
          "title": "Series 5A, 5B and 5C Switch Boxes",
          "revision_date": "2025-04-23",
          "sha256": "832c5906e219425ae9470f1576596191ba3ab9bb2927de11fea203720942dfee",
          "bytes": 398130,
          "http_status": 200,
          "mime_verified": true,
          "found_on": "https://www.bray.com/valves-actuators-controls/control-accessories/switch-boxes/series-5a-switch-box",
          "variant_skus": []
        },
        {
          "url": "https://www.bray.com/docs/default-source/brochures/product-brochures/s5a/series-5a-valve-status-monitor-technical-manual.pdf",
          "doc_type": "spec_sheet",
          "priority": "primary",
          "lang": "en",
          "title": "Series 5A Switch Box",
          "revision_date": "2022-10-14",
          "sha256": "17c841abe194ee70cf1ae8f8b3058175d48b043110a779e43313a95381c69b0c",
          "bytes": 395821,
          "http_status": 200,
          "mime_verified": true,
          "found_on": "https://www.bray.com/valves-actuators-controls/control-accessories/switch-boxes/series-5a-switch-box",
          "variant_skus": []
        }
      ],
      "images": [
        {
          "url": "https://www.bray.com/images/default-source/products/controls/s5a/2025_s5a_92-93_mccannalok-s40_41_8in_homehero_0100.webp",
          "image_type": "product_photo",
          "width": 2000,
          "height": 1269,
          "phash": "f7c39a8d89b8d882",
          "found_on": "https://www.bray.com/valves-actuators-controls/control-accessories/switch-boxes/series-5a-switch-box"
        },
        {
          "url": "https://www.bray.com/images/default-source/products/controls/s5a/2025_s5a_exp_02-copy.webp",
          "image_type": "product_photo",
          "width": 2000,
          "height": 2000,
          "phash": "e9a1865e9a617987",
          "found_on": "https://www.bray.com/valves-actuators-controls/control-accessories/switch-boxes/series-5a-switch-box"
        },
        {
          "url": "https://www.bray.com/images/default-source/products/controls/s5a/series5a-cutaway-1-min.webp",
          "image_type": "product_photo",
          "width": 1145,
          "height": 1625,
          "phash": "fab4854b1f6c20b3",
          "found_on": "https://www.bray.com/valves-actuators-controls/control-accessories/switch-boxes/series-5a-switch-box"
        }
      ]
    },
    {
      "family_id": "series-70-haz",
      "name": "Series 70-HAZ",
      "canonical_url": "https://www.bray.com/valves-actuators-controls/actuators/electric-actuator/series-70-hazardous-location",
      "specs": {},
      "variants": [],
      "documents": [
        {
          "url": "https://www.bray.com/docs/default-source/brochures/product-brochures/en_vac_broc.pdf",
          "doc_type": "brochure",
          "priority": "secondary",
          "lang": "en",
          "title": "Valve Automation Centre (VAC)",
          "revision_date": "2024-08-13",
          "sha256": "580ecba3789ab1b0c5984b2d6a2dbd515e57b56f346ca7714513ac91ffe79df8",
          "bytes": 2301552,
          "http_status": 200,
          "mime_verified": true,